{
  "$schema": "https://json.schemastore.org/claude-code-plugin-manifest.json",
  "name": "code-skills",
  "displayName": "Code Discipline",
  "version": "2.2.0",
  "description": "Engineering discipline with reusable formatting, type, contract, test, dead-code, mutation, flake, and architecture gates.",
  "author": {
    "name": "Ben Reich",
    "url": "https://github.com/benrben"
  },
  "homepage": "https://github.com/benrben/code-skills",
  "repository": "https://github.com/benrben/code-skills",
  "keywords": ["engineering", "quality", "coverage", "mutation-testing", "architecture"]
}
